00:00.0 Class [0600]: Device [1b36:0008]
	Subsystem: Device [1af4:1100]
	Control: I/O- Mem- BusMaster- SpecCycle- MemWINV- VGASnoop- ParErr- Stepping- SERR- FastB2B- DisINTx-
	Status: Cap- 66MHz- UDF- FastB2B- ParErr- DEVSEL=fast >TAbort- <TAbort- <MAbort- >SERR- <PERR- INTx-

00:01.0 Class [0200]: Device [1af4:1000]
	Subsystem: Device [1af4:0001]
	Control: I/O- Mem- BusMaster- SpecCycle- MemWINV- VGASnoop- ParErr- Stepping- SERR- FastB2B- DisINTx-
	Status: Cap+ 66MHz- UDF- FastB2B- ParErr- DEVSEL=fast >TAbort- <TAbort- <MAbort- >SERR- <PERR- INTx-
	Interrupt: pin A routed to IRQ 0
	Region 0: I/O ports at 1000 [disabled] [size=32]
	Region 1: Memory at 10180000 (32-bit, non-prefetchable) [disabled] [size=4K]
	Region 4: Memory at 8000000000 (64-bit, prefetchable) [disabled] [size=16K]
	Expansion ROM at 10100000 [virtual] [disabled] [size=512K]
	Capabilities: [98] MSI-X: Enable- Count=4 Masked-
		Vector table: BAR=1 offset=00000000
		PBA: BAR=1 offset=00000800
	Capabilities: [84] Vendor Specific Information: VirtIO: <unknown>
		BAR=0 offset=00000000 size=00000000
	Capabilities: [70] Vendor Specific Information: VirtIO: Notify
		BAR=4 offset=00003000 size=00001000 multiplier=00000004
	Capabilities: [60] Vendor Specific Information: VirtIO: DeviceCfg
		BAR=4 offset=00002000 size=00001000
	Capabilities: [50] Vendor Specific Information: VirtIO: ISR
		BAR=4 offset=00001000 size=00001000
	Capabilities: [40] Vendor Specific Information: VirtIO: CommonCfg
		BAR=4 offset=00000000 size=00001000

00:02.0 Class [00ff]: Device [1234:11e8] (rev 10)
	Subsystem: Device [1af4:1100]
	Control: I/O- Mem- BusMaster- SpecCycle- MemWINV- VGASnoop- ParErr- Stepping- SERR- FastB2B- DisINTx-
	Status: Cap+ 66MHz- UDF- FastB2B- ParErr- DEVSEL=fast >TAbort- <TAbort- <MAbort- >SERR- <PERR- INTx-
	Interrupt: pin A routed to IRQ 0
	Region 0: Memory at 10000000 (32-bit, non-prefetchable) [disabled] [size=1M]
	Capabilities: [40] MSI: Enable- Count=1/1 Maskable- 64bit+
		Address: 0000000000000000  Data: 0000

